{
  "type": "scored_reviews",
  "product_name": "Linear",
  "product_context": "Linear is a project-management tracker for software teams, in the same category as Jira and Asana. Public complaints cluster around cycles, notifications, and seat price. Competitors include Jira and Height.",
  "total_reviews": 1,
  "reviews": [
    {
      "id": 1,
      "text": "The product is fine, I guess. It works.",
      "rating": 4,
      "plutchik": {
        "joy": 0.1,
        "trust": 0.2,
        "fear": 0.0,
        "surprise": 0.0,
        "sadness": 0.45,
        "disgust": 0.05,
        "anger": 0.05,
        "anticipation": 0.1
      },
      "dissonance": {
        "detected": true,
        "type": "positive_words_negative_emotions",
        "explanation": "Uses affirming language ('fine', 'it works') while sadness dominates — resignation masked as satisfaction."
      },
      "maslow_need": "esteem",
      "emotion_summary": "Resignation masked as satisfaction"
    }
  ]
}